proposal_id;proposal_text;creation_datetime;nb_entailed_proposals;nb_contradictory_proposals;nb_votes_for;nb_votes_mixed;nb_votes_against;nb_args_for;nb_args_against;controversiality_nli;controversiality_votes;controversiality_args;label
3d0d69e9-e908-11e9-adee-0242ac110003;Prendre en compte le fait d'avoir des enfants à charge. Le fait d’avoir des enfants peut entraîner des dépenses supplémentaires. Aujourd’hui, certaines prestations comme le revenu de solidarité active (RSA) tiennent compte de cette situation et sont augmentées lorsque le foyer a des enfants à charge. Le Revenu universel d’activité pourrait reprendre cette logique.;2019-10-07 15:42:00;18;62;967;129;282;139;84;0.3015873015873015;0.3755697356426618;0.6071428571428571;rua value
856b9b29-ea63-11e9-bb9d-0242ac110002;La vie doit être gratuite, donc établissons un revenu universel, pour tous, sans aucun calcul, en éliminant toute les autres aides.. Le revenu universel doit rendre gratuit, l'eau, le gaz, l'électricité, le logement, la nouriture, l'éducation, les soins et la dépendances. Le revenu universel sera modulé en fonction de la capacité collective (Citoyens, Europe, Etat, Régions, Départements, Communes) à rendre gratuit les besoins primaires.;2019-10-09 09:07:00;1;235;41;14;40;9;5;0.0084745762711864;0.9821428571428572;0.6;basic needs support
de61ce87-ea5e-11e9-bb9d-0242ac110002;Aucune. Revenu universel, versé à tous. Ceux qui ont un travail reverront un peu du fruit de leur travail. Les entrepreneurs auront un filet de sécurité pour leur permettre de changer d’activité au besoin. Et de toute façon tous ceux qui ont un revenu sont taxé dessus.;2019-10-09 08:34:00;0;267;99;2;18;6;3;0.003731343283582;0.2058823529411764;0.5714285714285714;rua for everybody without conditions
ada4aeaa-ea62-11e9-bb9d-0242ac110002;Prestations sociales récupérables sur la succession. Toutes les prestations sociales doivent être récupérables sur la succession.;2019-10-09 09:01:00;1;224;15;6;57;3;6;0.0088888888888888;0.34375;0.5714285714285714;financing
f75d4bdd-ea60-11e9-bb9d-0242ac110002;La dignité ça se mérite et ce n'est pas de l'argent. Donner de l'argent ne signifie pas qu'on donne les moyens de devenir digne. Quelqu'un qui est ivre mort toute la journée ou qui est défoncé par une drogue dure pourra recevoir tout l'argent du monde, ça ne lui rendra pas sa dignité (expérience en centre d'accueil à l'appui !). Quelqu'un dont la culture est de voler ne deviendra pas digne non plus. Le Revenu Universel d'Activité ne devra être attribué que sous condition d'attitude constructive et conforme aux lois de la République.;2019-10-09 08:49:00;7;3;28;7;46;4;8;-1.0;0.6666666666666666;0.5555555555555556;rua for everybody with conditions
f67b42c8-eaa4-11e9-bb9d-0242ac110002;A toutes les personnes qui s'engage à faire évoluer la société dans le bon sens en consacrant 5 heures de leur temps toutes les semaines à la faire évoluer.. Pour ma part, ce revenu devrait s'adresser à toutes les personnes qui ont la volonté de faire évoluer la société dans le bon sens. Indépendamment de l'age ou de la situation sociale. Ces personnes devront au choix :Être actif dans un projet, une organisation, une entreprise reconnus comme d'utilité social.*Être impliqué dans la vie dans leur quartier, leur commune, leur régions ...etc;2019-10-09 16:56:00;17;22;5;2;6;4;8;0.782608695652174;-1.0;0.5555555555555556;rua for everybody with conditions
35394d49-e907-11e9-adee-0242ac110003;"Mettre en place un système dans lequel l'allocataire s'engage à rechercher un emploi. Pour ceux qui peuvent travailler, notre système de solidarité repose aujourd’hui sur des engagements contractuels prévoyant des engagements pour l'allocataire et pour les pouvoirs publics. Le Revenu universel d’activité doit également être construit autour d’un contrat prévoyant de tels engagements; avec de possibles sanctions (comme par exemple la suspension ou l’interruption du versement de l’aide). Il doit aussi prendre en compte les publics qui sont plus éloignés du marché du travail en raison d’un handicap ou de leur âge; et leur garantir un soutien et préserver le caractère inconditionnel des aides au logement qui ne reposent pas sur une logique contractuelle et de recherche d'emploi.";2019-10-07 15:34:00;7;28;675;224;670;152;275;0.2758620689655172;0.9944444444444444;0.5543478260869565;disability allowance
461ec15f-e906-11e9-adee-0242ac110003;Instaurer un montant minimum permettant de faire du Revenu universel d'activité un filet de sécurité. Le montant minimum du Revenu universel d’activité doit être établi de manière à garantir à chacun un niveau de vie minimum. ;2019-10-07 15:27:00;7;18;1300;223;182;252;138;0.4210526315789473;0.2664041994750656;0.549407114624506;basic needs support
05cd4047-e907-11e9-adee-0242ac110003;Faire en sorte qu'un allocataire retrouvant un travail gagne systématiquement davantage à la fin du mois. Le Revenu universel d’activité doit garantir que le retour au travail paye systématiquement pour inciter à la reprise d’une activité, même en cas de temps de travail très faible. Un allocataire du Revenu universel d’activité qui retrouve un emploi ne peut pas conserver intégralement ses aides et les cumuler avec ses revenus d’activité et celles-ci doivent diminuer progressivement selon des règles claires et compréhensibles par tous. Il ne faut pas non plus qu’il perde immédiatement toutes ses aides dès la reprise d’un emploi, si ses revenus restent faibles.;2019-10-07 15:33:00;9;31;1192;171;161;162;86;0.3125;0.2441348973607038;0.5337423312883436;rua value
a6bd393e-ea59-11e9-bb9d-0242ac110002;Revenu vraiment universel (et unique). Pour que ce revenu soit vraiment universel il faut :par définition que tout le monde le perçoive (et non pas que ce soit comme toujours uniquement ceux qui vivent au crochet des autres ...)supprimer toutes les autres aides ;2019-10-09 07:57:00;2;106;136;36;38;14;7;0.02803738317757;0.4335260115606936;0.5333333333333333;rua for everybody without conditions
0707ca26-e906-11e9-adee-0242ac110003;"Calculer le Revenu universel d'activité selon les revenus les plus récents. Aujourd’hui, les différentes aides peuvent être calculées en fonction des ressources de l’année précédente ou des mois précédents. L’objectif du Revenu universel d’activité est de s’assurer que le soutien offert aux personnes en situation de pauvreté soit réactif et ajusté à la situation de la personne; en le calculant selon les revenus les plus récents (par exemple ceux des trois derniers mois) plutôt que des revenus trop anciens (par exemple ceux de l’année précédente).";2019-10-07 15:26:00;18;120;2152;323;427;363;192;0.1570247933884297;0.3033117932148627;0.5302197802197802;rua value
cfbdb3fb-ea75-11e9-bb9d-0242ac110002;"Passer d'un Revenu Universel d'Activité à un Revenu Universel. Je me rends compte que cela est une notion très nouvelle, je vais donc suivre le plan demandé pour ensuite écrire une explication qui contiendra l'ensemble de mes arguments.1 - Les conditions pour bénéficier du Revenu Universel d'activitéAucune, autre qu'avoir la nationalité Française et d'être majeur. Pourquoi pas l'interrompre dans le cas d'un emprisonnement, ou cas similaires où l'Etat prend en charge l'individu.2 - Les modalités de demande du Revenu Universel d'activitéAu mieux, le faire automatiquement le jour des 18 ans de tout individu Français ou le jour de la naturalisation de tout étranger de plus de 18 ans. Cela pourrait se matérialiser sous forme d'un email et / ou d'une lettre spécifiant comment transmettre le compte en banque sur lequel recevoir ce revenu, et pour le seul intérêt de l'information, proposer une zone de rédaction libre sur comment le revenu sera utilisé.3 - Le financement du Revenu Universel d'activitéPremièrement, Le Revenu Universel d'Activité (que dans le cadre ce cette proposition nous devrions appeler RU) devra remplacer toute un groupe d'aide sociales existantes  : allocations chômage, allocations logement, allocations familiales... Cela en paye donc déjà une partie conséquente. Deuxièmement, mener une politique de taxation en rapport avec l'automatisation (la proposition de ""taxe sur les robots"" de Mr. Hamon aux dernières présidentielles est un assez bon exemple), ce qui devrait rapporter une autre partie conséquente de la somme nécessaire, tout en ne prenant que de ceux qui peuvent, de très loin, se permettre de payer. Troisièmement, il est très probable que le RU se payera partiellement de lui même : mettez tout cet argent dans les mains d'une population qui, en moyenne, touche 1700 euros par mois, et vous le verrez presque immédiatement ""ruisseler vers le haut"", et par la TVA, en grande partie revenir dans les caisses du gouvernement. Quatrièmement, la somme mensuelle de ce revenu pourra être ajustée dans le temps à mesure que l'automatisation progresse. Notre économie est déjà très automatisée, mais d'autres grands paliers seront bientôt dépassés : transport automatisé, service automatisé...Le reste devrait être finançable par emprunt, initialement. Le but est évidemment de ne pas constamment accentuer la dette Française (qui, disons le, n'est pas par elle même une si mauvaise chose : il faut s'intéresser également au patrimoine Français, CAD à la valeur du pays entier comparé à sa dette). ExplicationAux Etats Unis, une nouvelle idée radicale pour l'économie d'aujourd'hui et future prend racine : le Revenu Universel. Le principe : donner une somme d'argent chaque mois à chaque citoyen du pays sans aucune conditions d'accès : celui ci n'est pas perdu si le citoyen travaille, notamment. De même, sans conditions de dépense : l'argent est déposé sur un compte en banque et le gouvernement ne s'intéresse pas à comment cet argent est dépensé.Chez les Américains, un candidat pour les primaires démocrate défend cette idée : Andrew Yang. J'invite tous les lecteurs à aller voir son site et les nombreuses vidéos parlant de lui sur Youtube. Pour résumer : 1000 dollars par mois à tous les Américains majeurs, qu'il appelle le ""Freedom Dividend"" (""Dividende de libération""). Il ne fait pas l'erreur de voir le RU comme une simple mesure anti-pauvreté, de charité : il voit cela comme un ""dividende national"" sur toutes les richesses produites notamment par les GAFA qui, comme chez nous, ne payent pas grand chose en taxes fédérales là bas. En France, le RU n'a fait que brièvement surface lors de la campagne de Benoît Hamon aux dernières présidentielles, pour très rapidement retomber dans l'obscurité. Notre pays n'était pas prêt à recevoir cette idée. Néanmoins, il est temps de regarder la réalité en face : l'automatisation, depuis des décennies, est une automatisation qui détruit bien plus d'emplois qu'elle n'en crées. Nous n'avons jamais remplacé les pertes d'emploi dans l'industrie : certains accusent la concurrence déloyale des pays en développement, mais ils oublient une chose ! En effet, la raison pour laquelle ces secteurs ne sont pas encore automatisés complètement est justement dû au fait qu'il est encore aujourd'hui moins cher de faire vivre un humain dans la misère en le faisant travailler, que de faire construire et entretenir un automate. Néanmoins, que pensez vous qu'il arrivera le jour où nous mettrons fin à cette pratique ? La production reviendrait peut être en France, mais sans les emplois. Très bientôt, des millions d'emplois de camionneurs, caissiers, agents bureaucratiques (ex banques), travailleurs manuels seront remplacés par des automates. S'en suivra, peut être plus lentement, beaucoup de corps de métiers que l'on ne soupçonnerait pas être propices à l'automatisation : radiologues, chirurgiens, experts comptables... j'en passe beaucoup. Ces métiers ne seront pas totalement remplacés comme les autres, mais chaque travailleur de ces secteurs aura accès à une productivité de plus en plus élevée, ce qui forcera des dépôts de bilan, des licenciements et une réduction des salaires. Pouvez vous imaginer un monde tel que celui-ci, sans Revenu Universel ou mesures similaires ? Je le résume : Une caste d'ultra-riche propriétaires des moyens de productions automatisés. Une caste de gens moyennement riches qui seront au service de la caste d'au dessus en tant qu'ingénieur, domestique, ou dans d'autres secteurs du service de luxe. Le reste de la population, vivant dans la pauvreté absolue car leur place dans l'économie ne sera plus justifiée par l'économie elle même. Pourquoi vouloir financer la consommation d'une telle masse ? Contrairement à une idée reçue, elle n'est pas nécessaire à l'économie. Et nous savons tous ce qui arrivera rapidement si nous nous dirigeons vers ce monde : la révolte. Et la révolte n'est pas toujours source de progrès, et sera probablement très destructrice. Avantages du Revenu UniverselLibération... De la société face à l'automatisation : le temps de production fait par un robot au lieu d'un humain sera du temps gagné collectivement pour poursuivre des activités plus épanouissantes, au lieu que cela n'augmente que le bénéfice d'un propriétaire. Des citoyens pour lutter contre l'émission des éléments polluants. Cet argent supplémentaire servira, en même temps, d'allocation de transition vers les véhicules électriques, d'allocation pour la mise en place d'énergies vertes, d'allocation pour la consommation locale et de bonne qualité et le circuit court. Des esprits entrepreneurs et créatifs, qui auront maintenant un vrai soutien de l'Etat pour aider leur idée à voir le jour. Des employés qui disposeront de ce levier supplémentaire dans leur rapport de force avec l'employeur, malgré le chômage. Fraternisation des Français. Vivre dans la pauvreté et la non-confiance dans l'avenir n'encourage pas à aimer son voisin, ou au moins à ne pas avoir peur de lui. Egalement, le Revenu arrêterait la progression de la société vers le scénario-catastrophe décrit plus haut.Égalisation...  La nouvelle politique de taxation par elle même contribuera à faire revenir des richesses des mains des ultra-riches vers les mains plus modestes. Le Revenu signifiera l'explosion des commerces locaux, car les gens auront de nouveau les moyens de s'offrir les services et produits locaux de meilleure qualité, au lieu d'être contraint à consommer de la marchandise bon marché venant parfois de loin. Cette explosion économique dans ces secteurs signifiera par elle même l'enrichissement de beaucoup : Boulangers, bouchers, agriculteurs - vendeurs en circuit court, travailleurs manuels indépendants, garagistes...Un nouveau modèle de société où la production et le progrès, indirectement, avantage la société entière au lieu de n'avantager qu'une poignée de riches investisseurs. Une nouvelle manière de voir le rôle de l'Etat et l'ouverture de la porte vers des politiques d'Etat efficaces de lutte contre la criminalité, l'abus de substances, la dépression & suicide, et toutes les autres problématiques plus abstraites que la pauvreté économique, qui n'existera virtuellement plus. Remarques fréquentes & réponses ""Le Revenu Universel n'est pas finançable !""Faux ! Commençons par dire que le Revenu Universel est une notion d'économie assez abstraite qui peut, mathématiquement, s'appliquer à tout économie en fonction de deux facteurs :Le nombre de travailleurs dans cette économieLa productivité par travailleurLa seule économie où le revenu universel est totalement impossible est alors une économie où soit rien n'est produit (mais dans ce cas nous avons probablement un soucis plus grave...), soit une économie où chacun ne peut produire que ce qu'il consomme (lui, et sa famille). Nous n'avons jamais été dans le premier cas (nous serions tous morts sinon), et nous n'avons pas été dans le second cas depuis le Néolithique. En 2019, nous sommes dans une économie où le nombre de travailleurs reste énorme malgré le chômage, et où chaque travailleur, selon les secteurs, peut produire de quelques fois à plusieurs dizaines de fois de plus que leur équivalent d'il y a seulement un siècle. Il est plutôt difficile de déterminer sur quelle somme mensuelle ce nouveau Revenu se placerait aujourd'hui. Certain disent 50 euros par mois (ce qui me semble très, très peu), d'autres le placent au Salaire Minimum de Croissance (ce qui ne me semble pas impossible, mais beaucoup pour un début). Il faudra l'ajuster régulièrement, avec une politique de transparence totale sur l'indice qui détermine le montant final distribué à chacun.""Le Revenu Universel fera que les gens arrêtent de travailler !""Même en supposant que l'ensemble des travailleurs travaillent uniquement pour manger, boire, se loger et se vêtir, ce ne serait pas tout à fait vrai. En effet, prenez une minute pour imaginer l'impact qu'aurait un tel revenu sur les salaires ! Les ""sales boulots"" devront offrir une paye plus en adéquation avec la difficulté de leur tâche. Pour le reste des métiers, même si les salaires allaient à diminuer (en raison, par exemple, des taxes supplémentaires), les gens ne seraient probablement pas satisfaits de vivre uniquement de leur Revenu en ayant l'intégralité de leur temps libre : chacun pourrait trouver son juste milieu entre gagner plus d'argent et avoir plus de temps libre, qui aujourd'hui n'est pas vraiment possible à moins d'être très qualifié.Et ce n'est pas le cas. Beaucoup travaillent car ils y trouvent un accomplissement d'eux même. Donnez du temps et du financement à presque n'importe qui, et vous les verrez entreprendre quelque chose avec ce temps et cet argent (pas toujours quelque chose de purement économique néanmoins, mais par exemple du bénévolat). ";2019-10-09 11:18:00;0;3;86;4;5;9;4;-1.0;0.1098901098901098;0.5;universal salary/rua for everybody without conditions
