proposal_id;proposal_text;creation_datetime;nb_entailed_proposals;nb_contradictory_proposals;nb_votes_for;nb_votes_mixed;nb_votes_against;nb_args_for;nb_args_against;controversiality_nli;controversiality_votes;controversiality_args;label
8fbd2656-ea6f-11e9-bb9d-0242ac110002;Non à l'anonymat dans cette consultation. Pour cette consultation citoyenne deux règles de bases auraient dut être instituées : 1 s'exprimer avec son identité - 2 Etre Electrice ou Electeur inscrit;2019-10-09 10:34:00;3;15;20;9;24;6;6;-1.0;0.8823529411764706;1.0;basic needs support/general questioning
9dd187ba-ea6a-11e9-bb9d-0242ac110002;Supprimer toutes les aides sauf pour les handicapés. Pour éviter de faire de faire de la France un peuple d'assistés, supprimons toutes les aides sauf pour les handicapés. Cela redonnera l'envie de créer, de se battre pour réussir... Il est inconcevable de donner des allocations à des jeunes de 18 ans comme projeté;;4;210;12;5;46;5;5;0.0236966824644549;0.3461538461538461;1.0;disability allowance
60fadc6a-ea5f-11e9-bb9d-0242ac110002;Pas de récupération sur succession du Revenu Universel d'Activité en y intégrant ASPA. ASPA est aujourd'hui récupérable sur succession, ce qui n'est pas le cas des autres prestations que le gouvernement souhaite fusionner dans ce nouveau dispositif. Il ne faudrait pas que le revenu universel d'activité soit récupérable sur succession si l'ASPA y est intégrée.;2019-10-09 08:38:00;245;55;38;18;17;5;5;0.2276422764227642;0.631578947368421;1.0;financing
d911e77f-ea55-11e9-bb9d-0242ac110002;activité en contrepartie du Revenu Universel d'Activité. en contrepartie du Revenu Universel d'Activité le bénéficiaire doit participer à une formation en entreprise ou autre, ou bien travailler en doublon dans le public ou le privé, pour rester actif.quand on est inactif on perd l'habitude de travailler. ;2019-10-09 07:30:00;8;4;66;13;66;17;17;-1.0;1.0;1.0;terminology
82a27ea5-ea53-11e9-bb9d-0242ac110002;Les travailleurs pauvres. Actuellement, le travail ne permet plus de vivre décemment. Le salaire minimum est inférieur au prix de certains loyers. Le revenu minimum doit permettre à tout travailleur de vivre décemment.;2019-10-09 07:13:00;1;15;60;6;9;6;6;-1.0;0.2388059701492537;1.0;rua for everybody with conditions
d1419ee6-e907-11e9-adee-0242ac110003;"Adapter le montant du Revenu universel d'activité au coût de la vie selon les territoires. Le coût de la vie n’est pas identique partout sur le territoire. Certaines dépenses (logement en particulier mais également transports ou prix de certains produits de première nécessité) peuvent varier considérablement."" Le Revenu universel d’activité pourrait prendre en compte une partie de ces variations par exemple dans le cadre d'un regroupement avec les aides au logement. """;2019-10-07 15:38:00;5;24;511;229;442;88;101;0.24;0.9068825910931174;0.8725490196078431;digitization and simplification
d0e0e477-ea69-11e9-bb9d-0242ac110002;Créer des emplois heureux. Côté salariés = je travail pour le plaisir car je n'ai plus la peur de ne pas subvenir aux besoins de mes proches et moi mêmeCôté entreprise = je baisse le coût du travail en France et en fait l'un des pays les plus compétitifs d'Europe voir mondialPour cela il faut ouvrir ce dispositif a tous des la majorité. Et ce, sans distinction de revenus. Un pays sans pauvreté et une créativité sans limite. Ça vous tente ?;2019-10-09 09:53:00;1;67;41;8;4;5;6;0.0294117647058823;0.26;0.8571428571428571;rua for everybody without conditions
c967e7bd-ea65-11e9-bb9d-0242ac110002;Fonctionnement RU. un seul numéro celui de la CPAM pour une meilleure harmonisation et de meilleurs contrôle entre les organismes. Que la Caisse d'Allocation Familiale devienne une filiale de la CPAM. allocation qui n’augmente pas au dessus de 3 enfants suppression des aides superflues qui s’accumulent pas plus de 2 RU par foyer fiscal si 2 RU dans le même foyer diminution du RU, pas payer 2 allocations logement pour le même foyer ;2019-10-09 09:24:00;1;57;13;6;7;4;5;0.0344827586206896;0.7;0.8333333333333334;protection of beneficiaries
b1c7e0d5-ea84-11e9-bb9d-0242ac110002;"la transparence honnête. Puisque nous somme à l'aire du numérique je pense qu'il serait tout à fait possible de regrouper toutes les aides en un service automatisé, et que le Revenu Universel d'Activité devienne une garantie de ne plus jamais atteindre un certain seuil de pauvreté, que l'on pourrais choisir en échange de sa transparence :Si vous décidiez de signer pour avoir une garantie Revenu Universel d'Activité, vous vous engagez à être transparents sur vos revenus via votre compte en banque, en échange de quoi l'état vous verserait la différence qu'il vous reste a atteindre pour être au dessus du seuil fixé. ( calculé en fonction de votre situation, le loyer minimum de votre ville, votre âge, etc )Si vous décidiez de ne pas être transparent sur votre compte en banque avec l'état, alors vous ne pourrez pas demander de garantie Revenu Universel d'Activité. L'on éviterai ainsi pas mal de fraudes .De son côté l'état pourrait prélever l’impôt à la source ( juste et équitable) en fonction des revenus de la personne sur le mois, beaucoup de paperasse serait ainsi éviter :pour les micro entrepreneurs par exemple, l'état pourrait voir les réels revenus, charges et bénéfices d'une personnes, il ne serait pas nécessaire de faire la traque aux gens qui ne déclarent pas les revenus de ventes de créations artisanales puisque tout apparaîtrait sur leur compte en banque. La vente d'objets d'occasion par exemple pourrait ne pas être imposable au dessous d'un certains seuil de bénéfices pour ne pas enfoncer encore plus les personnes sans ressources qui se débrouillent comme elles peuvent pour survire, et ce peu importe que les objets ai été achetés par cette même personne ou non, car ainsi le marché de l'occasion grandirait et permettrait un recyclage permanent des tonnes de choses que les français plus riches jettent chaque année. Ainsi, si par exemple en revendant vos vieux objets, ou des objets que vos proches vous auraient donné pour vous aider, si vous réalisez l'équivalent d'un Salaire Minimum de Croissance sur le mois vous serez imposé comme une personne salariée au Salaire Minimum de Croissance. cela me parait complètement équitable.l'état pourrait prendre en compte les charges de chacun en fonction du coût de la vie moyen dans la région, et prendre en charges le minimum vital pour payer l'eau, un loyer modeste et la nourriture si la personne vit en dessous du fameux seuil fixé.l'Etat pourrait récupérer cette somme en taxant davantage les pollueurs, les gens ou les entreprises qui consomment trop d'eau ou de ressources naturelles ( exemple : les agriculteurs qui réalisent des cultures pas adaptées à leurs régions et qui réclament davantage d'arrosage, ou encore les particuliers qui dépensent beaucoup trop d'eau ou d'électricité par rapport à leur réels besoins )je pense qu'il est important que chacun apporte sa part à la société et que à partir du moment ou l'on vous garantie un Revenu Universel d'Activité vous devez contribuer à l’impôt ( aussi symbolique soit il. pourquoi pas 1€ au lieu de 0€ pour les plus basses tranches ? ), et que l'Etat doit pouvoir nous faire savoir où part cet argent, et ne pas dépenser plus que necessaire dans le ""protocole"", les repas, les déplacement des élus ( comme les préfets qui abusent souvent de leurs droits ) etc.";2019-10-09 13:05:00;14;13;12;8;17;4;5;0.9333333333333332;0.8076923076923077;0.8333333333333334;digitization and simplification
94e60ab2-ea77-11e9-bb9d-0242ac110002;"Coupler Revenu Universel d'Activité et action environnementale citoyenne. Notre pauvreté s'élevait à presque 9 millions de personnes il y a un ou deux mois encore. Et si on utilisait les dérives de notre modèle économique historique pour en faire une force face au changement climatique ? Sollicitons nos demandeurs de revenu d'activité pour qu'ils mènent une activité qui préserve l'environnement, leur donne du sens et leur redonne confiance sur le long terme. L'objectif ? > Redonner du sens et de la confiance à des personnes inactives depuis du court, du moyen ou du long terme.> Lutter pour limiter l'émission de Gaz à effet de serre en décernant une activité ""carbone positive""> Amorcer un changement de comportements, de mentalités.> Offrir un avenir moins hostile à nos enfants Comment ? 1) Rôle des bénéficiaires des aidesIls obtiennent leur revenu d'activité en échange de leur activité ""carbon positive""C'est quoi une activité ""carbone positive"" ?Ce sont les actions réalisées pour préserver l'environnement.> des actions de sensibilisation> des actions concrêtes sur le terrain> des actions de recherche (pour trouver de nouvelles solutions / nouvelles actions positives)Il y aura plusieurs niveaux d'actions : celles qui ne nécessitent pas de formation, celles qui en demanderont et celles qui demanderont une réelle spécialisation métier. Selon leurs parcours et leurs ambitions, les bénéficiaires du revenu d'activité pourront être orientés sur la nature de leur action. 2) Rôle de l'état> Créer une nouvelle branche pôle emploi : elle évalue les compétences et les ambitions des demandeurs pour proposer les activités ""carbone-positives"" recherchées.> Des structures pilotes dans 4 à 5 municipalités pour commencer et améliorer le dispositif dès aujourd'hui.> Anticiper et faire face aux freins lobbyistes.> Une implémentation en 2023.Combien ça coûte ? La vraie question est combien on gagne, car, que des activités puissent être menées sans formation immédiatement ou qu'elles exigent certaines formations (il devra y avoir un nivellement de la formation, c'est évident), les bénéfices seront économiques et humains. Une fois le dispositif en place, la plus-part des actions évoquées deviendront peut-être des métiers ou des compétences à réinvestir dans de futurs emplois et autant d'économies générées par des profils plus valorisés et valorisant.  9 millions de personnes actives, qui retrouvent le goût du labeur avec fierté et sens, qui obtiennent leurs aides et qui agissent pour demain, cela peut ne pas être qu'une utopie. Il n'y a aucun frein à une telle perspective sauf si l'on inclue quelques lobbies de l'industrie du carbone. Nous pourrons dire à nos enfants : nous sommes conscients et nous agissons pour vous socialement et pour l'environnement. Si vous réagissez à cette proposition, merci d'être empathique, ne jouez pas sur les mots, pour être constructifs ensemble. Je pourrais préciser des exemples d'activités si la proposition va plus loin. Je sais qu'en imaginant un tel dispositif, vous l'irradirez de nouvelles perspectives.  Etienne, Citoyen et père de famille.";2019-10-09 11:31:00;104;9;20;8;12;4;5;0.0952380952380952;0.7241379310344828;0.8333333333333334;rua value/disability allowance/basic needs support
3610cdce-ea74-11e9-bb9d-0242ac110002;Un Revenu Universel d'Activité sur mesure. Parce que toutes les personnes n'ont pas les mêmes besoins et les mêmes attentes selon leur tranche d'âge, il serait nécessaire de penser ce Revenu Universel d'Activité autour d'un socle commun en rapport avec les aides indispensables à tous, comme le logement. Et, en fonction de la tranche d'âge (RUA accessible dès 18 ans lorsqu'il n'y pas de prise en charge parentale), du revenu et de la composition de la famille, des blocs de prestations (identiques pour les mêmes profils) seraient ajoutés de façon automatique. Par exemple, un jeune de 18 ans qui entame une licence pro en alternance pourrait bénéficier du socle de base (logement s'il ne vit plus chez ses parents, par exemple) + prime activité pour compléter son salaire touché au titre de l'alternance + bourse d'études. Une femme seule avec deux enfants (il faut en finir avec seuil de trois enfants pour toucher des aides quand on est seul : quand on est seul que l'on ait un ou deux enfants, on est très embêté si on ne touche pas un bon salaire). Elle pourrait toucher le socle de base + prime activité + aide sociale enfance + aide rentrée scolaire + prime Noël....Un couple avec trois enfants : socle de base + prime activité + aide sociale enfance + aide rentrée scolaire + prime Noël....Une personne âgée socle de base + minimum vieillesse + aide aux loisirs/sports + prime vacances;2019-10-09 11:07:00;62;77;22;8;5;4;5;0.8076923076923077;0.4516129032258064;0.8333333333333334;basic needs support/rua for everybody with conditions
fd0fecbb-ea6e-11e9-bb9d-0242ac110002;Garantie Universelle d'Activité. L'État garantit à chaque résident un travail, payé par le Revenu Universel d'Activité et on supprime la plupart des aides. Donc plus d'allocation chômage, Revenu de Solidarité Active, Allocation aux Adultes Handicapés, ... mais des vrais salaires correspondants à un vrai travail. Toute personne peut travailler (mais pas n'importe quelle tâche), et ce n'est pas le travail qui manque. Le Revenu Universel d'Activité correspond alors à la rémunération pour une activité, et n'est plus une 'aide sociale' stigmatisante. Ce Revenu Universel d'Activité fixe alors la valeur du Salaire Minimum de Croissance, et créera une hausse des salaires ailleurs: pour un même salaire, par l'exemple l'ouvrier du BTP prendra le Revenu Universel d'Activité plutôt que les conditions pénibles de son travail: l'employeur devra donc compenser la pénibilité (hausse de salaire, période de vacances, voiture de fonction ...). De même, la disparition des Aide Personnalisée au Logement crée une pression vers une baisse des loyers. L’État garde la liberté de faire évoluer le montant de la Revenu Universel d'Activité à la hausse (pour compenser l'inflation) ou à la baisse (pour inciter à un retour à l'emploi), ou de différencier le montant par région, territoire ou ville. Il y a un important travail théorique sous-jacent qui montre les bienfaits de cette idée (ici par exemple). L'expérimentation des 'territoires zéro chômeur longue durée' en cours en France montre également que c'est possible et réaliste.;2019-10-09 10:30:00;52;63;19;5;23;5;4;0.828125;0.8620689655172413;0.8333333333333334;general questioning
dc49e33a-ea6d-11e9-bb9d-0242ac110002;redonner un semblant de pouvoir d'achat aux plus pauvres pour consommer differemment. une généralisation des allocations devrait progressivement permettre aux plus démunis de ne plus être seulement des clients de supermarché! Il faudrait réussir à sortir le maximum de personnes de cette pauvreté qui consiste à consommer pour survivre et non de consommer intelligemment, écologiquement et citoyennement... et par là même donner enfin un avenir au commerce de proximité et donc à notre planète!;2019-10-09 10:21:00;69;10;18;16;13;5;4;0.1571428571428571;0.8571428571428571;0.8333333333333334;digitization and simplification
7f3f9156-ea9e-11e9-bb9d-0242ac110002;Instauration d'une TVA sociale associée à une diminution des charges salariales. Augmenter la TVA en contrepartie d'une baisse des charges salariales, aurait un effet bénéfique pour l'économie du pays et permettrait de financer la mesure. L'assiette de calcul de la TVA, c'est la totalité des biens et services vendus en France, y compris sur des produits fabriqués à coût ridicule dans des pays émergents, qui font la fortune des grossistes français. L'assiette de calcul des charges salariales est beaucoup plus faible que celle de la TVA (sinon, on n'aurait que des sociétés qui versent plus de salaires qu'elles ne vendent de produits ou de services : pas très viable !).Le différentiel entre 1% de TVA en plus et 1% de charges salariales en moins génèrerait donc un surplus suffisant pour financer la mesure tout en favorisant le made in France et l'emploi local (les chiffres sont donnés au pifomètre et doivent être adaptés, mais l'idée est là : 1% de TVA, c'est beaucoup, beaucoup plus d'argent que 1% de prélevements sur les salaires).;2019-10-09 16:10:00;9;3;4;3;8;5;4;-1.0;-1.0;0.8333333333333334;financing
5b9d81f7-ea63-11e9-bb9d-0242ac110002;Prendre l'argent là où il y en a. Taxer la publicité et/ou rétablir l'ISF et/ou taxer les transactions financières par exemple;2019-10-09 09:06:00;0;48;42;5;10;4;5;0.0204081632653061;0.3333333333333333;0.8333333333333334;financing
bcfcb753-ea5b-11e9-bb9d-0242ac110002;Donner de son temps à la Société en échange d'aide. Toutes les personnes touchant des revenus issus d’impôt payés par l'ensemble des français, doivent contribuer à la vie de la Société par des travaux d’intérêt général. Très facile à mettre en place, il suffit de rattacher la personne à son lieu de contribution en l’occurrence à la mairie de son domicile. Nombreuses taches à réaliser : renseignements,accueil public, propreté,etc. Contribution minimum de 20h par semaine sur 5 jours.;2019-10-09 08:12:00;6;6;45;15;35;9;7;-1.0;0.8360655737704918;0.8;rua value
f7e8bec4-e905-11e9-adee-0242ac110003;"Regrouper et harmoniser un maximum d'aides sociales. Aujourd’hui, selon sa situation, une personne peut demander plusieurs aides différentes en même temps. Par exemple le Revenu de Solidarité Active si elle n’a pas d’activité et les Aide Personnalisée au Logement pour financer son logement. Le Revenu universel d’activité vise à regrouper les minima sociaux; la prime d’activité et les aides au logement pour lutter plus efficacement contre la pauvreté.";2019-10-07 15:25:00;25;125;2252;507;779;627;469;0.2063492063492063;0.4663043478260869;0.7484076433121019;digitization and simplification
b1b7cff7-e908-11e9-adee-0242ac110003;Détecter les personnes éligibles au Revenu universel d'activité afin de les informer de leur droit. Avec le prélèvement à la source et le grand nombre d’informations dont disposent les administrations, on pourrait plus facilement détecter les personnes qui pourraient bénéficier du Revenu universel d’activité voire le proposer ou l’actualiser automatiquement, mais chacun pourrait refuser de bénéficier de cette aide s’il ne le souhaite pas. ;2019-10-07 15:45:00;4;5;642;57;99;77;57;-1.0;0.2242857142857142;0.7435897435897436;digitization and simplification
2fbf1d46-e908-11e9-adee-0242ac110003;"Prendre en compte les revenus de tout le foyer. Le fait de vivre en couple ou à plusieurs permet à une famille de faire des économies d’échelle sur certaines dépenses, par exemple en matière de loyer. C’est pourquoi aujourd’hui, notre modèle de prestations sociales, comme notre modèle fiscal, reposent sur une logique de foyers et tous les revenus du foyer sont pris en compte, même si c’est parfois à des degrés divers, comme pour l’AAH par exemple."" Le Revenu universel d’activité pourrait reprendre cette logique. Il pourrait à l’inverse être versé individuellement à chaque personne sans tenir compte d’économies d’échelles dans les dépenses afin de favoriser son autonomie voire même sans prendre en compte les revenus du conjoint par exemple. Cela pourrait être moins intrusif dans la vie privée mais conduirait à aider davantage un couple qu’une personne seule.  """;2019-10-07 15:41:00;0;41;733;216;817;186;254;0.0238095238095238;0.9187620889748548;0.7333333333333333;rua value
9d8fda65-e907-11e9-adee-0242ac110003;"Assurer l'accès à un accompagnement social à toutes les personnes qui sont éloignées du marché du travail. Certaines personnes qui bénéficient d’une aide sont soutenues justement parce qu’elles ne peuvent pas ou très difficilement travailler. C’est par exemple le cas pour les allocataires de l’AAH. Pour ces personnes; l’engagement à rechercher un emploi ne doit pas constituer une condition pour bénéficier de l’allocation; mais un accompagnement doit systématiquement être proposé pour les aider dans leur parcours de vie et favoriser toute forme d’activité qui rejoindrait leurs attentes en termes de participation sociale et d’épanouissement.";2019-10-07 15:37:00;6;24;890;178;133;132;95;0.28;0.2918615528531337;0.7218045112781954;rua for everybody without conditions/protection of beneficiaries
c3061cf5-ea60-11e9-bb9d-0242ac110002;Dès la naissance, être déclaré sur les registres d'état civil et versement automatique. Dès la naissance, être déclaré sur les registres d'état civil et versement automatique ;2019-10-09 08:48:00;36;2;56;4;30;6;4;0.081081081081081;0.5737704918032787;0.7142857142857143;digitization and simplification
c4433241-e907-11e9-adee-0242ac110003;"Intégrer les aides au logement dans le Revenu universel d'activité. Les personnes en situation de pauvreté consacrent une part importante de leur budget aux dépenses de logement. 46% du revenu des bénéficiaires de minima sociaux est ainsi consacré à ces dépenses de logement contre 23% pour l’ensemble des ménages. Regrouper les aides au logement et les minima sociaux à travers le Revenu universel d'activité; comme annoncé par le Président de la République; permettra de mieux lutter contre la pauvreté de ces personnes en limitant les ruptures de droits et en garantissant un gain à la reprise d'activité. Ce regroupement devra tenir compte des équilibres de la politique du logement. ";2019-10-07 15:38:00;3;19;589;180;542;89;133;0.2;0.938961038961039;0.6716417910447762;general questioning
87cd530d-ea60-11e9-bb9d-0242ac110002;Individualiser le Revenu Universel d'Activité et plutôt que de  l'accorder à un foyer. Les personnes , même en couple, même mariées devraient pouvoir bénéficier d'un revenu individuel, permettant ainsi à chacun ou chacune de fonctionner indépendamment, (je pense par exemple aux personnes au foyer assujetties à un conjoint violent et qui ne peuvent pas partir, faute de revenu, ou aux personnes qui souhaitent faire une formation, mais rencontrent des difficultés financières, la Caisse d'Allocation Familiale actuellement demande à vérifier le moindre centime mis de coté, et en tient compte pour diminuer les aides)Individualiser le Revenu Universel d'Activité en en donnant l’accès aux jeunes en formation, dès 18 ans sans condition de travail, permettrait aussi de diminuer la difficulté pour les familles pauvres d'accompagner les jeunes en formation, facilitant ainsi la mobilité sociale.;2019-10-09 08:46:00;28;3;86;7;14;8;5;0.1379310344827586;0.2340425531914893;0.6666666666666666;rua value/protection of beneficiaries
11d83c2f-e908-11e9-adee-0242ac110003;"Les personnes âgées en situation de pauvreté. Le système actuel permet aux personnes âgées d'accéder à un seuil minimal de ressources avec l'allocation de solidarité aux personnes âgées (ASPA). Pourtant, les allocataires de l'Allocation de solidarité aux personnes âgées sont aujourd'hui confrontés à de nombreuses difficultés d'accès à leurs droits à l'âge de la retraite et de nombreuses personnes renoncent à la demander."" Le Revenu universel d'activité pourrait s'adresser à eux.""";2019-10-07 15:40:00;45;99;1048;114;243;154;102;0.46;0.3078245915735167;0.6645161290322581;rua for senior
bb45aaaa-ea6b-11e9-bb9d-0242ac110002;Justificatif. On se doit de prendre en compte le revenu de tout le foyer. Des enquêtes se doivent d’être faites pour éviter les arnaques. On se doit aussi de dire aux bénéficiaires que cet argent ne se doit pas d’être dépenser dans des choses superflues et inutiles...Il se doit d’être un complément de salaire. Arrêtons les aides « gratuite » sans incitation à un retour à l’emplois, ou à la participation à la société (service civique, bénévolat,...);2019-10-09 10:06:00;9;19;11;1;15;4;7;0.5;0.7647058823529411;0.625;rua for everybody without conditions
b4674581-e907-11e9-adee-0242ac110003;"Harmoniser le mode de calcul des droits au Revenu universel en prenant en compte les mêmes ressources pour tout le monde. Aujourd’hui, les différentes aides sociales ne prennent pas en compte les mêmes ressources : parfois il faut déclarer la même chose que pour l’impôt sur le revenu, parfois non. "" L’objectif du Revenu universel d’activité est de toujours devoir déclarer le même type de revenu pour en simplifier l’accès et la compréhension. """;2019-10-07 15:38:00;6;18;937;115;146;95;59;0.3684210526315789;0.2488129154795821;0.625;digitization and simplification
150890ce-ea54-11e9-bb9d-0242ac110002;Lutter contre les loyers élevés par d'autres moyens pour que l'Etat fasse des économies. Les propriétaires sont les premiers à profiter des allocations logement. Il serait bien d'imposer très fortement les loyers déraisonnables pour décourager les propriétaires un peu trop gourmands.;2019-10-09 07:17:00;1;45;108;22;19;15;9;0.0434782608695652;0.3206106870229007;0.625;basic needs support
f0175fce-e908-11e9-adee-0242ac110003;Financer le Revenu universel d'activité par la solidarité nationale. Aujourd’hui, les prestations qui pourraient composer le Revenu universel d’activité sont financées principalement par l’État (APL, Allocation Adulte Handicapé, prime d’activité) mais le Revenu de Solidarité Active est financé par les départements. ;2019-10-07 15:47:00;8;23;344;131;122;86;53;0.375;0.5336134453781513;0.6206896551724138;financing
